{
    "schemaVersion":  1,
    "mapFamily":  "RebornHotS",
    "mapId":  "ZLab2",
    "mapName":  "Lab 2 - Echoes of the Future",
    "mapAdapter":  "reborn",
    "entryType":  "direct",
    "commanderSlots":  [
                           {
                               "slotIndex":  0,
                               "playerId":  1,
                               "commanderId":  null,
                               "allowRuntimeOverride":  true,
                               "startPosition":  "default"
                           }
                       ],
    "pairPatches":  [

                    ],
    "requiredDependencies":  {
                                 "always":  [
                                                "file:Mods/crys_the_swarm_reborn.SC2Mod",
                                                "file:Mods/Reborn/RebornBridge.SC2Mod",
                                                "file:Mods/Reborn/RebornMapAdapter.SC2Mod"
                                            ]
                             },
    "bankProtection":  {
                           "protectedBanks":  [
                                                  "cryswarmcoop",
                                                  "ZCampaign",
                                                  "ZCampaignStats",
                                                  "ZStory",
                                                  "ZArmy",
                                                  "TCampaign"
                                              ],
                           "playerBanks":  {
                                               "1":  "cryswarmcoop"
                                           }
                       },
    "victoryCondition":  {
                             "type":  "native",
                             "trigger":  "libRebornAdapter_TriggerVictory"
                         },
    "defeatCondition":  {
                            "type":  "native",
                            "trigger":  "libRebornAdapter_TriggerDefeat"
                        }
}