{
  "schemaVersion": 1,
  "mapFamily": "RebornHotS",
  "mapId": "ZExpedition3",
  "mapName": "Harvest of Screams",
  "mapAdapter": "reborn",
  "entryType": "direct",
  "commanderSlots": [
    {
      "slotIndex": 0,
      "playerId": 1,
      "commanderId": null,
      "startPosition": "default",
      "allowRuntimeOverride": true
    }
  ],
  "pairPatches": [],
  "requiredDependencies": {
    "always": [
      "file:Mods/crys_the_swarm_reborn.SC2Mod",
      "file:Mods/Reborn/RebornBridge.SC2Mod",
      "file:Mods/Reborn/RebornMapAdapter.SC2Mod"
    ]
  },
  "bankProtection": {
    "protectedBanks": [
      "cryswarmcoop",
      "ZCampaign",
      "ZCampaignStats",
      "ZStory",
      "ZArmy",
      "TCampaign"
    ],
    "playerBanks": {
      "1": "cryswarmcoop"
    }
  },
  "victoryCondition": {
    "type": "native",
    "trigger": "libRebornAdapter_TriggerVictory"
  },
  "defeatCondition": {
    "type": "native",
    "trigger": "libRebornAdapter_TriggerDefeat"
  }
}